{
  "formatVersion": 1,
  "createdAt": "2026-10-23T18:30:00Z",
  "app": { "id": "app.mauri.cucuto", "versionName": "1.0.0", "versionCode": 1 },
  "settings": { "enabled": true, "uiSounds": false },
  "repositories": [
    { "url": "https://cucuto.mauri.app/repo/repository.json", "name": "Official packs", "isDefault": true, "auth": { "type": "none" } },
    { "url": "https://packs.example.com/private/", "auth": { "type": "basic" } }
  ],
  "packs": [
    { "id": "app.mauri.demo.chiptune-critters", "type": "pack", "version": "1.0.0", "sha256": "2222222222222222222222222222222222222222222222222222222222222222", "size": 40000, "source": { "type": "repository", "repositoryUrl": "https://cucuto.mauri.app/repo/repository.json" } },
    { "id": "com.example.private.songs", "type": "bundle", "version": "3.0.0", "packs": ["com.example.private.songs.day"], "sha256": "3333333333333333333333333333333333333333333333333333333333333333", "source": { "type": "local", "fileName": "songs.soundpack" } }
  ],
  "contacts": [
    {
      "id": "c1",
      "displayName": "Ada",
      "phoneNumbers": ["+34600111222"],
      "keys": [{ "package": "com.whatsapp", "conversationKey": "34600111222@s.whatsapp.net" }],
      "androidContact": { "lookupKey": "0r1-ABC", "displayName": "Ada Lovelace" },
      "message": { "packId": "app.mauri.demo.chiptune-critters", "characterId": "frog", "disabledClips": ["characters/frog/clips/croak.ogg"], "haptic": { "mode": "custom", "events": [{ "at": 0, "preset": "CLICK" }] } },
      "ringtone": { "packId": "com.example.private.songs.day", "characterId": "bubblegum", "rule": { "mode": "fixed", "variant": "characters/bubblegum/ringtones/live.ogg" } }
    },
    {
      "id": "g1",
      "displayName": "Family",
      "isGroup": true,
      "groupPolicy": "per-sender",
      "keys": [{ "package": "com.whatsapp.w4b", "conversationKey": "120363000000000000@g.us" }]
    }
  ]
}
